{
  "$schema": "http://json-schema.org/draft-07/schema#",
  "$ref": "#/definitions/JewelsMaterial",
  "definitions": {
    "JewelsMaterial": {
      "type": "object",
      "properties": {
        "id": {
          "type": "string"
        },
        "name": {
          "type": "string"
        },
        "description": {
          "type": "string"
        },
        "source": {
          "type": "array",
          "items": {
            "type": "string"
          }
        },
        "rarity": {
          "type": "number"
        },
        "craft": {
          "type": "object",
          "properties": {
            "cost": {
              "type": "number"
            },
            "items": {
              "type": "array",
              "items": {
                "type": "object",
                "properties": {
                  "id": {
                    "type": "string"
                  },
                  "name": {
                    "type": "string"
                  },
                  "amount": {
                    "type": "number"
                  }
                },
                "required": [
                  "id",
                  "name",
                  "amount"
                ],
                "additionalProperties": false
              }
            }
          },
          "required": [
            "cost",
            "items"
          ],
          "additionalProperties": false
        },
        "convert": {
          "type": "array",
          "items": {
            "type": "object",
            "additionalProperties": {
              "type": "object",
              "properties": {
                "id": {
                  "type": "string"
                },
                "name": {
                  "type": "string"
                },
                "amount": {
                  "type": "number"
                }
              },
              "required": [
                "id",
                "name",
                "amount"
              ],
              "additionalProperties": false
            }
          }
        },
        "version": {
          "type": "string"
        }
      },
      "required": [
        "id",
        "name",
        "description",
        "source",
        "rarity"
      ],
      "additionalProperties": false
    }
  }
}